{
  "aar_metrics_cited": {
    "cooldown_utilization_us": 1.0,
    "focus_fire_redundancy": 0.0,
    "mean_pairwise_distance_us": 202.6845,
    "outcome": "DRAW",
    "shots_fired_us": 10,
    "shots_hit_us": 10,
    "ticks": 121
  },
  "advice_to_future_self": "carry forward",
  "fitness": 0.0,
  "fitness_delta": null,
  "generation": 0,
  "hypothesis_tested": "accept-if-better candidate; measure combat metrics and compare to prior champion",
  "mechanism_expected": "mean score improves over champion",
  "mechanism_observed": "mean=+0.000 ci=[+0.000,+0.000]",
  "model": "claude-haiku-4-5",
  "outcome_summary": "accepted: a=0 b=0 draws=10 invalid=0",
  "parent_generation": null,
  "schema_version": 1,
  "seed": 44,
  "status": "ok",
  "tactic_tags": [
    "accept_if_better",
    "loose_formation"
  ],
  "timestamp_utc": "2026-04-24T15:18:54Z",
  "track": "A",
  "validation": {
    "metrics_match_aar": true,
    "rewrites": 0,
    "schema_valid": true
  },
  "verdict": "confirmed"
}